Tytuł Oferty,Wynagrodzenie (Potencjalne),Opis,Źródło,Kategoria,Stawka,Link do aplikacji
Zdalna Asystentka / Specjalista Excel,2500 - 4500 zł,"Naucz się Excela od podstaw, aby samodzielnie tworzyć zestawienia, raporty i arkusze. Kluczowa umiejętność w każdej pracy biurowej i zdalnej.",Excel / Dane,4000 zł,https://strefakursow.pl/?ref=371976
Copywriting i Tworzenie Treści SEO,3000 - 6000 zł,"Zacznij zarabiać, pisząc teksty dla firm, blogów i stron internetowych. Praca 100% zdalna, którą możesz wykonywać w elastycznym czasie.",Copywriting / Kreatywna,4500 zł,https://strefakursow.pl/?ref=371976
Tworzenie Sklepów i Stron WWW (WordPress),4000 - 8000 zł,"Zdobądź zawód Web Developera. Naucz się, jak stawiać proste strony WWW dla małych biznesów. Wysokie stawki za projekt.",IT / Programowanie,6000 zł,https://strefakursow.pl/?ref=371976
Grafik / Projektant Social Media,2000 - 3500 zł,"Przekształć pasję w pracę! Twórz grafiki na Facebooka, Instagrama i reklamy dla klientów. Idealne jako dodatkowe zajęcie.",Grafika / Design,3000 zł,https://strefakursow.pl/?ref=371976
Zarządzanie Czasem i Narzędziami Zdalnymi,Większa efektywność,"Kurs nauki planowania pracy, komunikacji online i użycia narzędzi takich jak Trello, Slack i Google Drive.",Produktywność,0 zł,https://strefakursow.pl/?ref=371976